"Story","Title","Result","Date","Stability","Duration (s)"
"Wordle Status Check","We can check the status of the Wordle service by sending a GET to /api/service","SUCCESS","2024-01-10T18:19:11.934548389Z[Etc/UTC]","0.0","2.19"
"Creating a new game","The new game should initially be In Progress","SUCCESS","2024-01-10T18:19:11.927997008Z[Etc/UTC]","0.0","2.22"
"Getting hints","Requesting another hint","SUCCESS","2024-01-10T18:19:16.804483757Z[Etc/UTC]","0.0","1.89"
"Playing the game","Invalid words should be rejected with a 403 error","SUCCESS","2024-01-10T18:19:12.892276414Z[Etc/UTC]","0.0","1.27"
"Playing the game","Should show row of colored cells","SUCCESS","2024-01-10T18:19:16.81157052Z[Etc/UTC]","0.0","2.14"
