"Story","Title","Result","Date","Stability","Duration (s)"
"Game Rules","Letters should be displayed with the correct color","SUCCESS","2024-01-16T09:03:45.454942476Z[Etc/UTC]","0.0","0.21"
"Game Rules","Player runs out of tries","SUCCESS","2024-01-16T09:03:45.522444326Z[Etc/UTC]","0.0","0.08"
"Game Rules","Player guesses the right word","SUCCESS","2024-01-16T09:03:45.623176662Z[Etc/UTC]","0.0","0.02"
"Game Rules","Letters that are present but not in the right place","SUCCESS","2024-01-16T09:03:45.642779033Z[Etc/UTC]","0.0","0.01"
"Game Rules","Letters that do not form valid words should be rejected","SUCCESS","2024-01-16T09:03:45.660053839Z[Etc/UTC]","0.0","0.07"
"Game Rules","Two incorrectly placed letters","SUCCESS","2024-01-16T09:03:45.673117944Z[Etc/UTC]","0.0","0.01"
"Game Rules","Correctly placed letters","SUCCESS","2024-01-16T09:03:45.689140525Z[Etc/UTC]","0.0","0.04"
