"Story","Title","Result","Date","Stability","Duration (s)"
"Game Rules","Player runs out of tries","SUCCESS","2024-01-10T20:40:33.239825118Z[Etc/UTC]","0.0","0.3"
"Game Rules","Letters should be displayed with the correct color","SUCCESS","2024-01-10T20:40:33.286424249Z[Etc/UTC]","0.0","0.4"
"Game Rules","Letters that are present but not in the right place","SUCCESS","2024-01-10T20:40:33.570720709Z[Etc/UTC]","0.0","0.05"
"Game Rules","Player guesses the right word","SUCCESS","2024-01-10T20:40:33.581431641Z[Etc/UTC]","0.0","0.05"
"Game Rules","Correctly placed letters","SUCCESS","2024-01-10T20:40:33.635763977Z[Etc/UTC]","0.0","0.02"
"Game Rules","Letters that do not form valid words should be rejected","SUCCESS","2024-01-10T20:40:33.676083021Z[Etc/UTC]","0.0","0.05"
"Game Rules","Two incorrectly placed letters","SUCCESS","2024-01-10T20:40:33.693901777Z[Etc/UTC]","0.0","0.01"
