"Story","Title","Result","Date","Stability","Duration (s)"
"Game Rules","Letters should be displayed with the correct color","SUCCESS","2024-01-11T05:31:46.615445861Z[Etc/UTC]","0.0","0.44"
"Game Rules","Player runs out of tries","SUCCESS","2024-01-11T05:31:46.643518028Z[Etc/UTC]","0.0","0.28"
"Game Rules","Letters that are present but not in the right place","SUCCESS","2024-01-11T05:31:46.959649586Z[Etc/UTC]","0.0","0.05"
"Game Rules","Player guesses the right word","SUCCESS","2024-01-11T05:31:46.964744798Z[Etc/UTC]","0.0","0.05"
"Game Rules","Correctly placed letters","SUCCESS","2024-01-11T05:31:47.039628123Z[Etc/UTC]","0.0","0.04"
"Game Rules","Letters that do not form valid words should be rejected","SUCCESS","2024-01-11T05:31:47.045771102Z[Etc/UTC]","0.0","0.08"
"Game Rules","Two incorrectly placed letters","SUCCESS","2024-01-11T05:31:47.115147718Z[Etc/UTC]","0.0","0.01"
