"Story","Title","Result","Date","Stability","Duration (s)"
"Game Rules","Player runs out of tries","SUCCESS","2024-01-15T22:00:56.224530437Z[Etc/UTC]","0.0","0.29"
"Game Rules","Letters should be displayed with the correct color","SUCCESS","2024-01-15T22:00:56.274578709Z[Etc/UTC]","0.0","0.35"
"Game Rules","Letters that are present but not in the right place","SUCCESS","2024-01-15T22:00:56.557325832Z[Etc/UTC]","0.0","0.05"
"Game Rules","Player guesses the right word","SUCCESS","2024-01-15T22:00:56.580760892Z[Etc/UTC]","0.0","0.02"
"Game Rules","Two incorrectly placed letters","SUCCESS","2024-01-15T22:00:56.609236629Z[Etc/UTC]","0.0","0.04"
"Game Rules","Letters that do not form valid words should be rejected","SUCCESS","2024-01-15T22:00:56.618032282Z[Etc/UTC]","0.0","0.06"
"Game Rules","Correctly placed letters","SUCCESS","2024-01-15T22:00:56.666517394Z[Etc/UTC]","0.0","0.01"
